{"aggregate":{"budget_8_win_count":3,"interval_coverage":0.545064,"mean_budget_8_random_minus_learned_m":-0.475234,"mean_spearman":0.137194},"claim_boundary":"Qualifies a learned ranker for prospective testing; does not claim a new planner failure or production-driving result.","evaluation":"retrospective eligible-scenario-held-out qualification","experiment":"v6","feature_names":["current_longitudinal_gap_m","current_closing_speed_mps","current_lead_speed_mps","peak_deceleration_mps2","maximum_cumulative_speed_drop_mps","maximum_one_second_speed_drop_mps","braking_nonincrease_fraction","log1p_maximum_absolute_jerk_mps3","braking_onset_offset_s","speed_multiplier","normalized_mutation_distance","empirical_support_probability"],"gates":{"at_least_9_eligible_scenarios":true,"budget_8_advantage_at_least_0_25_m":false,"budget_8_wins_at_least_7_scenarios":false,"coverage_between_0_75_and_0_98":false,"mean_spearman_at_least_0_25":false,"minimum_500_unique_examples":true,"zero_scenario_leakage":true},"model_sha256":null,"onnx_sha256":null,"record_type":"planmargin.active_risk_qualification","redistribution":"aggregate_only","report_sha256":"8da5718ae26583d16badf207c9ebf487e84681f9844162759b0b88636d22810c","scenario_count":9,"schema_version":"1.0.0","source":"immutable natural-development-v1 real-WOMD Waymax outcomes","status":"qualification_no_go","stop_reason":null,"synthetic":false,"target":"tested_minimum_signed_separation_m","unique_example_count":2097}
